<?xml version="1.0" encoding="UTF-8"?>
<sms xmlns:xsi="http://www.w3.org/2001/XMLSchema-instance" 
 xsi:noNamespaceSchemaLocation="ejemploXSD.xsd">
     <from amigo="si">
         <nombre>Pepe</nombre>
     </from>
     <to>
         <nombre>Juan</nombre>
         <nombre>Maria</nombre>
     </to>
     <texto>Terminasteis los ejercicios de DTD?</texto>
     <fecha hora="18:00:00">29:03:2015</fecha>
</sms> 

